{
  "content": [
    {
      "id": "xxx",
      "type": "row",
      "componentName": "",
      "componentState": {
      },
      "content": [
        {
          "id": "sss",
          "type": "column",
          "componentName": "aaaa",
          "isClosable": true
        }
      ]
    }
  ],
  "dimensions": {
    "dragProxyHeight": 111,
    "minItemHeight": 1111
  },
  "labels": {
    "close": "ssss"
  },
  "settings": {
    "blockedPopoutsThrowError": false,
    "reorderEnabled": false,
    "showMaximiseIcon": true
  }
}